<?xml version="1.0" encoding="UTF-8"?>
<tns:notes xmlns:tns="http://www.epam.com/Noutbook" 
	xmlns:xsi="http://www.w3.org/2001/XMLSchema-instance" 
	xsi:schemaLocation="http://www.epam.com/Noutbook NotebookXMLSchema.xsd ">
	<note id="0">
		<date>400000000000</date>
		<content>St Note one</content>
	</note>
	<note id="1">
		<date>401000000000</date>
		<content>St Note two</content>
	</note>
	<note id="2">
		<date>402000000000</date>
		<content>St Note three</content>
	</note>
	<note id="3">
		<date>403000000000</date>
		<content>St Note four</content>
	</note>


</tns:notes>
